[
  {
    "id": "claude-sonnet-4",
    "name": "Claude Sonnet 4",
    "category": "llm",
    "subcategory": "general-purpose",
    "description": "Anthropic's balanced model in the Claude 4 family. Excels at agentic tasks, coding, and analysis. Strong instruction-following with extended context window.",
    "url": "https://www.anthropic.com/claude",
    "stars_approx": 0,
    "tags": ["anthropic", "coding", "agentic", "reasoning", "api"],
    "license": "proprietary",
    "added_date": "2026-04-14",
    "last_updated": "2026-04-14",
    "curator_note": "Best-in-class for agentic pipelines in 2026; computer-use ready.",
    "pricing": "paid",
    "maturity": "production"
  },
  {
    "id": "claude-opus-4",
    "name": "Claude Opus 4",
    "category": "llm",
    "subcategory": "frontier",
    "description": "Anthropic's most capable model. Top-tier reasoning, research synthesis, and complex multi-step agentic workflows.",
    "url": "https://www.anthropic.com/claude",
    "stars_approx": 0,
    "tags": ["anthropic", "frontier", "reasoning", "research", "api"],
    "license": "proprietary",
    "added_date": "2026-04-14",
    "last_updated": "2026-04-14",
    "curator_note": "Use when task complexity justifies cost. Unmatched on long-horizon reasoning.",
    "pricing": "paid",
    "maturity": "production"
  },
  {
    "id": "llama-4-scout",
    "name": "Llama 4 Scout",
    "category": "llm",
    "subcategory": "open-source",
    "description": "Meta's efficient open-weight model with 10M token context. Ideal for local deployment, RAG systems, and cost-sensitive production workloads.",
    "url": "https://llama.meta.com/",
    "github_url": "https://github.com/meta-llama/llama-models",
    "stars_approx": 48000,
    "tags": ["meta", "open-source", "local", "long-context", "rag"],
    "license": "Llama 4 Community License",
    "added_date": "2026-04-14",
    "last_updated": "2026-04-14",
    "curator_note": "The go-to open model for 2026 — 10M context is a game changer for RAG.",
    "pricing": "open-source",
    "maturity": "production"
  },
  {
    "id": "gemini-2-5-pro",
    "name": "Gemini 2.5 Pro",
    "category": "llm",
    "subcategory": "multimodal",
    "description": "Google DeepMind's top multimodal model. Excels at video understanding, code generation, and scientific reasoning with native tool use.",
    "url": "https://deepmind.google/technologies/gemini/",
    "stars_approx": 0,
    "tags": ["google", "multimodal", "video", "coding", "science"],
    "license": "proprietary",
    "added_date": "2026-04-14",
    "last_updated": "2026-04-14",
    "curator_note": "Best for video + code tasks. Competes directly with Claude Opus on benchmarks.",
    "pricing": "paid",
    "maturity": "production"
  },
  {
    "id": "deepseek-r2",
    "name": "DeepSeek R2",
    "category": "llm",
    "subcategory": "reasoning",
    "description": "DeepSeek's open reasoning model. Chain-of-thought specialist with strong math, science, and code benchmarks at significantly lower cost.",
    "url": "https://deepseek.com",
    "github_url": "https://github.com/deepseek-ai",
    "stars_approx": 82000,
    "tags": ["deepseek", "reasoning", "math", "open-source", "cost-efficient"],
    "license": "MIT",
    "added_date": "2026-04-14",
    "last_updated": "2026-04-14",
    "curator_note": "Unprecedented cost/performance ratio for reasoning tasks. Critical for cost-sensitive agentic pipelines.",
    "pricing": "open-source",
    "maturity": "stable"
  }
]
