[
  {
    "id": "mcp-filesystem",
    "name": "MCP Filesystem",
    "category": "mcp-server",
    "subcategory": "local",
    "description": "Official Anthropic MCP server for local filesystem access. Enables read/write file operations, directory traversal, and file search from within any MCP-compatible agent.",
    "url": "https://github.com/modelcontextprotocol/servers/tree/main/src/filesystem",
    "github_url": "https://github.com/modelcontextprotocol/servers",
    "stars_approx": 14000,
    "tags": ["mcp", "filesystem", "official", "local", "read-write"],
    "license": "MIT",
    "added_date": "2026-04-14",
    "last_updated": "2026-04-14",
    "curator_note": "Start here. The reference implementation — essential for any local agentic workflow.",
    "pricing": "open-source",
    "maturity": "production"
  },
  {
    "id": "mcp-github",
    "name": "MCP GitHub",
    "category": "mcp-server",
    "subcategory": "devtools",
    "description": "GitHub MCP server exposing repos, issues, PRs, code search, and commit history as agent-accessible tools. Powers code-review and devops automation agents.",
    "url": "https://github.com/modelcontextprotocol/servers/tree/main/src/github",
    "github_url": "https://github.com/modelcontextprotocol/servers",
    "stars_approx": 14000,
    "tags": ["mcp", "github", "devtools", "code-review", "ci-cd"],
    "license": "MIT",
    "added_date": "2026-04-14",
    "last_updated": "2026-04-14",
    "curator_note": "Essential for any dev-focused agent pipeline. PR review automation alone is worth the setup.",
    "pricing": "open-source",
    "maturity": "production"
  },
  {
    "id": "mcp-postgresql",
    "name": "MCP PostgreSQL",
    "category": "mcp-server",
    "subcategory": "database",
    "description": "Read-only PostgreSQL MCP server. Gives agents schema inspection and SQL query capabilities against your Postgres databases with safe sandboxing.",
    "url": "https://github.com/modelcontextprotocol/servers/tree/main/src/postgres",
    "github_url": "https://github.com/modelcontextprotocol/servers",
    "stars_approx": 14000,
    "tags": ["mcp", "postgresql", "database", "sql", "read-only"],
    "license": "MIT",
    "added_date": "2026-04-14",
    "last_updated": "2026-04-14",
    "curator_note": "The read-only constraint is the right call for production. Pair with a write-capable agent layer.",
    "pricing": "open-source",
    "maturity": "stable"
  },
  {
    "id": "mcp-brave-search",
    "name": "MCP Brave Search",
    "category": "mcp-server",
    "subcategory": "search",
    "description": "Brave Search API wrapped as an MCP server. Provides web and local search capabilities to agents without Google's privacy concerns. Includes news and image search.",
    "url": "https://github.com/modelcontextprotocol/servers/tree/main/src/brave-search",
    "github_url": "https://github.com/modelcontextprotocol/servers",
    "stars_approx": 14000,
    "tags": ["mcp", "search", "brave", "web", "privacy"],
    "license": "MIT",
    "added_date": "2026-04-14",
    "last_updated": "2026-04-14",
    "curator_note": "The privacy-respecting search default. Use this over SerpAPI for non-commercial agent projects.",
    "pricing": "freemium",
    "maturity": "stable"
  }
]
