[
  {
    "id": "mmlu",
    "name": "MMLU",
    "category": "dataset",
    "subcategory": "benchmark",
    "description": "Massive Multitask Language Understanding benchmark covering 57 subjects from STEM to law. The de facto standard for measuring a model's breadth of world knowledge.",
    "url": "https://huggingface.co/datasets/cais/mmlu",
    "github_url": "https://github.com/hendrycks/test",
    "stars_approx": 1200,
    "tags": ["benchmark", "evaluation", "knowledge", "multiple-choice", "academic"],
    "license": "MIT",
    "added_date": "2026-04-14",
    "last_updated": "2026-04-14",
    "curator_note": "Cited in virtually every LLM paper — the minimum bar for comparing model intelligence.",
    "pricing": "free",
    "maturity": "production"
  },
  {
    "id": "humaneval",
    "name": "HumanEval",
    "category": "dataset",
    "subcategory": "benchmark",
    "description": "OpenAI's hand-crafted coding benchmark of 164 Python programming problems. Measures functional code correctness by executing unit tests against model-generated solutions.",
    "url": "https://huggingface.co/datasets/openai/openai_humaneval",
    "github_url": "https://github.com/openai/human-eval",
    "stars_approx": 2200,
    "tags": ["benchmark", "coding", "python", "evaluation", "openai"],
    "license": "MIT",
    "added_date": "2026-04-14",
    "last_updated": "2026-04-14",
    "curator_note": "Gold standard for code generation benchmarking; pass@k metric is widely reproduced.",
    "pricing": "free",
    "maturity": "production"
  },
  {
    "id": "lmsys-chatbot-arena",
    "name": "LMSYS Chatbot Arena",
    "category": "dataset",
    "subcategory": "preference",
    "description": "Crowdsourced human preference dataset from the Chatbot Arena platform. Contains millions of pairwise model comparisons used to derive Elo-based LLM rankings.",
    "url": "https://huggingface.co/datasets/lmsys/chatbot_arena_conversations",
    "github_url": "https://github.com/lm-sys/FastChat",
    "stars_approx": 37000,
    "tags": ["preference", "rlhf", "ranking", "human-feedback", "evaluation"],
    "license": "CC-BY-4.0",
    "added_date": "2026-04-14",
    "last_updated": "2026-04-14",
    "curator_note": "The most trusted human-preference signal for LLM ranking; Elo scores are now industry-standard.",
    "pricing": "free",
    "maturity": "production"
  },
  {
    "id": "openhermes",
    "name": "OpenHermes 2.5",
    "category": "dataset",
    "subcategory": "instruction-tuning",
    "description": "High-quality synthetically generated instruction dataset of 1M samples curated by Teknium. Powers the Hermes family of fine-tunes and widely used for chat and tool-use SFT.",
    "url": "https://huggingface.co/datasets/teknium/OpenHermes-2.5",
    "stars_approx": 0,
    "tags": ["instruction-tuning", "synthetic", "sft", "chat", "tool-use"],
    "license": "CC-BY-4.0",
    "added_date": "2026-04-14",
    "last_updated": "2026-04-14",
    "curator_note": "The most-forked community SFT dataset; starting point for most open-model fine-tunes.",
    "pricing": "free",
    "maturity": "stable"
  },
  {
    "id": "the-stack",
    "name": "The Stack",
    "category": "dataset",
    "subcategory": "pretraining",
    "description": "BigCode's 6TB+ dataset of permissively licensed source code across 300+ programming languages. Used to train StarCoder and other open code models; opt-out mechanism included.",
    "url": "https://huggingface.co/datasets/bigcode/the-stack",
    "github_url": "https://github.com/bigcode-project/the-stack",
    "stars_approx": 1400,
    "tags": ["code", "pretraining", "open-source", "bigcode", "multilingual"],
    "license": "other",
    "added_date": "2026-04-14",
    "last_updated": "2026-04-14",
    "curator_note": "The largest permissively licensed code corpus; essential for training or evaluating code LLMs.",
    "pricing": "free",
    "maturity": "production"
  }
]
