[
  {
    "id": "attention-is-all-you-need",
    "name": "Attention Is All You Need",
    "category": "paper",
    "subcategory": "architecture",
    "description": "Vaswani et al. (2017) paper introducing the Transformer architecture. Replaces recurrence with self-attention, enabling parallelizable training and establishing the foundation for every modern LLM.",
    "url": "https://arxiv.org/abs/1706.03762",
    "stars_approx": 0,
    "tags": ["transformer", "attention", "architecture", "foundational", "nlp"],
    "added_date": "2026-04-14",
    "last_updated": "2026-04-14",
    "curator_note": "The most cited paper in AI history — every LLM traces its lineage directly to this work.",
    "pricing": "free",
    "maturity": "production"
  },
  {
    "id": "react-reasoning-acting",
    "name": "ReAct: Synergizing Reasoning and Acting in Language Models",
    "category": "paper",
    "subcategory": "agents",
    "description": "Yao et al. (2022) paper introducing the ReAct prompting paradigm. Interleaves chain-of-thought reasoning with action execution, forming the basis for most modern LLM agent architectures.",
    "url": "https://arxiv.org/abs/2210.03629",
    "stars_approx": 0,
    "tags": ["agents", "reasoning", "prompting", "tool-use", "foundational"],
    "added_date": "2026-04-14",
    "last_updated": "2026-04-14",
    "curator_note": "The paper that defined how agents think-then-act; directly implemented in LangChain and LlamaIndex.",
    "pricing": "free",
    "maturity": "production"
  },
  {
    "id": "chain-of-thought-prompting",
    "name": "Chain-of-Thought Prompting Elicits Reasoning in Large Language Models",
    "category": "paper",
    "subcategory": "prompting",
    "description": "Wei et al. (2022) Google Brain paper demonstrating that few-shot prompts with step-by-step reasoning examples unlock emergent multi-step reasoning in large language models.",
    "url": "https://arxiv.org/abs/2201.11903",
    "stars_approx": 0,
    "tags": ["prompting", "reasoning", "chain-of-thought", "few-shot", "emergent"],
    "added_date": "2026-04-14",
    "last_updated": "2026-04-14",
    "curator_note": "Introduced CoT — now the default prompting technique in every advanced LLM application.",
    "pricing": "free",
    "maturity": "production"
  },
  {
    "id": "constitutional-ai",
    "name": "Constitutional AI: Harmlessness from AI Feedback",
    "category": "paper",
    "subcategory": "alignment",
    "description": "Anthropic (2022) paper introducing Constitutional AI, where a model critiques and revises its own outputs according to a set of principles, enabling scalable AI alignment without human labels.",
    "url": "https://arxiv.org/abs/2212.08073",
    "stars_approx": 0,
    "tags": ["alignment", "rlhf", "safety", "anthropic", "self-critique"],
    "added_date": "2026-04-14",
    "last_updated": "2026-04-14",
    "curator_note": "Foundation of Claude's safety approach; CAI is now widely adopted for scalable alignment.",
    "pricing": "free",
    "maturity": "production"
  },
  {
    "id": "toolformer",
    "name": "Toolformer: Language Models Can Teach Themselves to Use Tools",
    "category": "paper",
    "subcategory": "tool-use",
    "description": "Schick et al. (2023) Meta AI paper where a model learns to call external APIs — calculators, search, calendars — by self-supervised insertion of API calls into training text.",
    "url": "https://arxiv.org/abs/2302.04761",
    "stars_approx": 0,
    "tags": ["tool-use", "api", "self-supervised", "meta", "function-calling"],
    "added_date": "2026-04-14",
    "last_updated": "2026-04-14",
    "curator_note": "Pioneered self-taught tool use — directly inspired function-calling in GPT-4 and Claude.",
    "pricing": "free",
    "maturity": "production"
  }
]
