[
  {
    "id": "langsmith",
    "name": "LangSmith",
    "category": "tool",
    "subcategory": "observability",
    "description": "LangChain's platform for tracing, evaluating, and monitoring LLM applications. Captures full chain traces, enables dataset-driven evaluation, and surfaces latency and cost metrics.",
    "url": "https://smith.langchain.com",
    "stars_approx": 0,
    "tags": ["observability", "tracing", "evaluation", "langchain", "monitoring"],
    "license": "proprietary",
    "added_date": "2026-04-14",
    "last_updated": "2026-04-14",
    "curator_note": "Essential observability layer for any LangChain or LangGraph production deployment.",
    "pricing": "freemium",
    "maturity": "production"
  },
  {
    "id": "weights-and-biases",
    "name": "Weights & Biases",
    "category": "tool",
    "subcategory": "experiment-tracking",
    "description": "MLOps platform for tracking experiments, versioning datasets and models, and visualizing training runs. Integrates with PyTorch, HuggingFace, and most major training frameworks.",
    "url": "https://wandb.ai",
    "stars_approx": 0,
    "tags": ["mlops", "experiment-tracking", "fine-tuning", "visualization", "collaboration"],
    "license": "proprietary",
    "added_date": "2026-04-14",
    "last_updated": "2026-04-14",
    "curator_note": "Industry-standard experiment tracker; indispensable for any serious fine-tuning project.",
    "pricing": "freemium",
    "maturity": "production"
  },
  {
    "id": "cursor",
    "name": "Cursor",
    "category": "tool",
    "subcategory": "ide",
    "description": "AI-first code editor built on VS Code with deeply integrated LLM assistance. Supports multi-file edits, codebase-aware chat, and inline completions from frontier models.",
    "url": "https://www.cursor.com",
    "stars_approx": 0,
    "tags": ["ide", "coding", "ai-assistant", "vscode", "productivity"],
    "license": "proprietary",
    "added_date": "2026-04-14",
    "last_updated": "2026-04-14",
    "curator_note": "Highest-leverage AI coding tool available; multi-file edits close the loop on agentic coding.",
    "pricing": "freemium",
    "maturity": "production"
  },
  {
    "id": "ollama",
    "name": "Ollama",
    "category": "tool",
    "subcategory": "local-inference",
    "description": "Run large language models locally on macOS, Linux, and Windows with a single CLI command. Ships with a REST API compatible with OpenAI's API surface for easy swapping.",
    "url": "https://ollama.com",
    "github_url": "https://github.com/ollama/ollama",
    "stars_approx": 98000,
    "tags": ["local", "inference", "open-source", "cli", "openai-compatible"],
    "license": "MIT",
    "added_date": "2026-04-14",
    "last_updated": "2026-04-14",
    "curator_note": "The easiest way to run open models locally — one command and it just works.",
    "pricing": "open-source",
    "maturity": "production"
  },
  {
    "id": "vllm",
    "name": "vLLM",
    "category": "tool",
    "subcategory": "inference-server",
    "description": "High-throughput and memory-efficient LLM inference server using PagedAttention. Supports continuous batching, tensor parallelism, and an OpenAI-compatible API for production serving.",
    "url": "https://docs.vllm.ai",
    "github_url": "https://github.com/vllm-project/vllm",
    "stars_approx": 42000,
    "tags": ["inference", "serving", "gpu", "throughput", "openai-compatible"],
    "license": "Apache-2.0",
    "added_date": "2026-04-14",
    "last_updated": "2026-04-14",
    "curator_note": "PagedAttention makes it 2-24x faster than naive serving — the default choice for GPU inference.",
    "pricing": "open-source",
    "maturity": "production"
  }
]
