[
  {
    "id": "deeplearning-ai-short-courses",
    "name": "DeepLearning.AI Short Courses",
    "category": "course",
    "subcategory": "applied",
    "description": "Free short courses from Andrew Ng's DeepLearning.AI covering LLM APIs, RAG, agents, fine-tuning, and prompt engineering. Designed for practitioners and taught with industry partners.",
    "url": "https://www.deeplearning.ai/short-courses/",
    "stars_approx": 0,
    "tags": ["free", "llm", "rag", "agents", "beginner-friendly"],
    "license": "proprietary",
    "added_date": "2026-04-14",
    "last_updated": "2026-04-14",
    "curator_note": "Fastest way to go from LLM novice to practitioner — free, concise, and highly practical.",
    "pricing": "free",
    "maturity": "production"
  },
  {
    "id": "fastai",
    "name": "fast.ai Practical Deep Learning",
    "category": "course",
    "subcategory": "deep-learning",
    "description": "Jeremy Howard's top-down practical deep learning course covering computer vision, NLP, and diffusion models using PyTorch and the fastai library. Free with Jupyter notebooks.",
    "url": "https://course.fast.ai",
    "github_url": "https://github.com/fastai/fastbook",
    "stars_approx": 22000,
    "tags": ["deep-learning", "pytorch", "free", "practical", "notebooks"],
    "license": "Apache-2.0",
    "added_date": "2026-04-14",
    "last_updated": "2026-04-14",
    "curator_note": "The best top-down ML course — gets practitioners building real models within hours of starting.",
    "pricing": "free",
    "maturity": "stable"
  },
  {
    "id": "karpathy-zero-to-hero",
    "name": "Andrej Karpathy's Neural Networks: Zero to Hero",
    "category": "course",
    "subcategory": "foundational",
    "description": "Andrej Karpathy's YouTube series building neural networks from scratch in Python — from micrograd to GPT-2. The deepest free treatment of how transformers actually work.",
    "url": "https://karpathy.ai/zero-to-hero.html",
    "github_url": "https://github.com/karpathy/nn-zero-to-hero",
    "stars_approx": 20000,
    "tags": ["foundational", "transformers", "from-scratch", "python", "youtube"],
    "license": "MIT",
    "added_date": "2026-04-14",
    "last_updated": "2026-04-14",
    "curator_note": "No other resource builds deeper intuition for how LLMs work — mandatory for serious practitioners.",
    "pricing": "free",
    "maturity": "stable"
  },
  {
    "id": "stanford-cs336",
    "name": "Stanford CS336: Language Models from Scratch",
    "category": "course",
    "subcategory": "academic",
    "description": "Stanford graduate course covering the full LLM training pipeline: tokenization, pretraining, RLHF, and inference optimization. Lectures and assignments publicly available.",
    "url": "https://stanford-cs336.github.io/spring2024/",
    "stars_approx": 0,
    "tags": ["stanford", "pretraining", "academic", "graduate", "rlhf"],
    "license": "unknown",
    "added_date": "2026-04-14",
    "last_updated": "2026-04-14",
    "curator_note": "The most rigorous public curriculum for understanding LLM internals end-to-end.",
    "pricing": "free",
    "maturity": "stable"
  },
  {
    "id": "huggingface-nlp-course",
    "name": "Hugging Face NLP Course",
    "category": "course",
    "subcategory": "nlp",
    "description": "Free official course from Hugging Face covering Transformers, fine-tuning, datasets, and deployment using the full HuggingFace ecosystem. Available in 10+ languages with interactive notebooks.",
    "url": "https://huggingface.co/learn/nlp-course",
    "github_url": "https://github.com/huggingface/course",
    "stars_approx": 4200,
    "tags": ["huggingface", "transformers", "fine-tuning", "free", "multilingual"],
    "license": "Apache-2.0",
    "added_date": "2026-04-14",
    "last_updated": "2026-04-14",
    "curator_note": "Best starting point for working with HuggingFace Transformers — comprehensive and free.",
    "pricing": "free",
    "maturity": "production"
  }
]
