[
  {
    "id": "chroma",
    "name": "Chroma",
    "category": "vector-db",
    "subcategory": "embedded",
    "description": "Open-source AI-native embedding database designed for LLM applications. Runs embedded or as a server; ideal for prototyping RAG systems locally with zero infrastructure.",
    "url": "https://www.trychroma.com",
    "github_url": "https://github.com/chroma-core/chroma",
    "stars_approx": 16000,
    "tags": ["open-source", "embeddings", "rag", "local", "python"],
    "license": "Apache-2.0",
    "added_date": "2026-04-14",
    "last_updated": "2026-04-14",
    "curator_note": "Fastest path from zero to working RAG prototype — no infra required.",
    "pricing": "open-source",
    "maturity": "beta"
  },
  {
    "id": "pinecone",
    "name": "Pinecone",
    "category": "vector-db",
    "subcategory": "managed",
    "description": "Fully managed cloud vector database with single-digit millisecond query latency at billion-vector scale. First-class support for hybrid dense+sparse search.",
    "url": "https://www.pinecone.io",
    "stars_approx": 0,
    "tags": ["managed", "cloud", "hybrid-search", "scalable", "production"],
    "license": "proprietary",
    "added_date": "2026-04-14",
    "last_updated": "2026-04-14",
    "curator_note": "Go-to managed option when you need billion-scale search without ops overhead.",
    "pricing": "freemium",
    "maturity": "production"
  },
  {
    "id": "qdrant",
    "name": "Qdrant",
    "category": "vector-db",
    "subcategory": "self-hosted",
    "description": "High-performance vector search engine written in Rust. Supports filtering, named vectors, and sparse vectors. Available as cloud or self-hosted with a gRPC/REST API.",
    "url": "https://qdrant.tech",
    "github_url": "https://github.com/qdrant/qdrant",
    "stars_approx": 21000,
    "tags": ["rust", "open-source", "self-hosted", "filtering", "grpc"],
    "license": "Apache-2.0",
    "added_date": "2026-04-14",
    "last_updated": "2026-04-14",
    "curator_note": "Best self-hosted option in 2026 — Rust performance with excellent filtering support.",
    "pricing": "open-source",
    "maturity": "production"
  },
  {
    "id": "weaviate",
    "name": "Weaviate",
    "category": "vector-db",
    "subcategory": "multimodal",
    "description": "Open-source vector database with built-in vectorization modules for text, images, and code. GraphQL API, multi-tenancy, and hybrid BM25+vector search out of the box.",
    "url": "https://weaviate.io",
    "github_url": "https://github.com/weaviate/weaviate",
    "stars_approx": 11000,
    "tags": ["open-source", "multimodal", "graphql", "hybrid-search", "multi-tenancy"],
    "license": "BSD-3-Clause",
    "added_date": "2026-04-14",
    "last_updated": "2026-04-14",
    "curator_note": "Unique built-in vectorizer modules make it ideal for multimodal RAG pipelines.",
    "pricing": "open-source",
    "maturity": "production"
  },
  {
    "id": "pgvector",
    "name": "pgvector",
    "category": "vector-db",
    "subcategory": "extension",
    "description": "Open-source PostgreSQL extension that adds vector similarity search. Store embeddings alongside relational data and query with standard SQL and ACID guarantees.",
    "url": "https://github.com/pgvector/pgvector",
    "github_url": "https://github.com/pgvector/pgvector",
    "stars_approx": 13000,
    "tags": ["postgresql", "sql", "open-source", "embeddings", "extension"],
    "license": "PostgreSQL",
    "added_date": "2026-04-14",
    "last_updated": "2026-04-14",
    "curator_note": "If your data is already in Postgres, pgvector removes the need for a separate vector store.",
    "pricing": "open-source",
    "maturity": "stable"
  }
]
