[
  {
    "id": "autogen-04",
    "name": "AutoGen 0.4",
    "category": "agent-framework",
    "subcategory": "multi-agent",
    "description": "Microsoft Research's asynchronous, event-driven multi-agent framework. Supports distributed agent networks with a pluggable model client interface.",
    "url": "https://microsoft.github.io/autogen/",
    "github_url": "https://github.com/microsoft/autogen",
    "stars_approx": 45000,
    "tags": ["microsoft", "multi-agent", "async", "event-driven", "python"],
    "license": "MIT",
    "added_date": "2026-04-14",
    "last_updated": "2026-04-14",
    "curator_note": "The async event-driven architecture in 0.4 is a major leap. Best for complex multi-agent systems.",
    "pricing": "open-source",
    "maturity": "stable"
  },
  {
    "id": "model-context-protocol",
    "name": "Model Context Protocol (MCP)",
    "category": "agent-framework",
    "subcategory": "protocol",
    "description": "Anthropic's open standard for connecting AI models to external data sources and tools. Becoming the universal interface layer for agentic systems in 2026.",
    "url": "https://modelcontextprotocol.io/",
    "github_url": "https://github.com/anthropics/anthropic-mcp",
    "stars_approx": 18000,
    "tags": ["anthropic", "mcp", "protocol", "tools", "standard", "interoperability"],
    "license": "MIT",
    "added_date": "2026-04-14",
    "last_updated": "2026-04-14",
    "curator_note": "The USB-C of AI tooling. Framework-agnostic and rapidly becoming an industry standard.",
    "pricing": "open-source",
    "maturity": "production"
  },
  {
    "id": "langgraph",
    "name": "LangGraph",
    "category": "agent-framework",
    "subcategory": "orchestration",
    "description": "Graph-based orchestration framework from LangChain. Build stateful, multi-actor agent applications with fine-grained control over cycles, branching, and persistence.",
    "url": "https://www.langchain.com/langgraph",
    "github_url": "https://github.com/langchain-ai/langgraph",
    "stars_approx": 12000,
    "tags": ["langgraph", "orchestration", "stateful", "python", "multi-agent"],
    "license": "MIT",
    "added_date": "2026-04-14",
    "last_updated": "2026-04-14",
    "curator_note": "Production-grade stateful agent orchestration. The graph model solves the 'agent loop' problem cleanly.",
    "pricing": "open-source",
    "maturity": "production"
  },
  {
    "id": "pydantic-ai",
    "name": "PydanticAI",
    "category": "agent-framework",
    "subcategory": "type-safe",
    "description": "Agent framework built on Pydantic for type-safe, structured LLM interactions. Integrates natively with FastAPI for production deployment.",
    "url": "https://ai.pydantic.dev/",
    "github_url": "https://github.com/pydantic/pydantic-ai",
    "stars_approx": 8500,
    "tags": ["pydantic", "type-safe", "fastapi", "structured-output", "python"],
    "license": "MIT",
    "added_date": "2026-04-14",
    "last_updated": "2026-04-14",
    "curator_note": "If you're already on FastAPI, this is the natural choice. Type safety catches bugs before production.",
    "pricing": "open-source",
    "maturity": "beta"
  }
]
