[
  {
    "id": "open-interpreter",
    "name": "Open Interpreter",
    "category": "project",
    "subcategory": "code-execution",
    "description": "Open-source implementation of ChatGPT's Code Interpreter that runs locally. Lets LLMs execute Python, JavaScript, and shell commands on your machine via a natural language interface.",
    "url": "https://openinterpreter.com",
    "github_url": "https://github.com/OpenInterpreter/open-interpreter",
    "stars_approx": 58000,
    "tags": ["code-execution", "local", "open-source", "python", "agentic"],
    "license": "AGPL-3.0",
    "added_date": "2026-04-14",
    "last_updated": "2026-04-14",
    "curator_note": "The most accessible local code-execution agent — bridges the gap between LLMs and your filesystem.",
    "pricing": "open-source",
    "maturity": "beta"
  },
  {
    "id": "autogpt",
    "name": "AutoGPT",
    "category": "project",
    "subcategory": "autonomous-agent",
    "description": "One of the first autonomous LLM agent frameworks. Chains GPT-4 calls with memory, web search, and file I/O to pursue long-horizon goals with minimal human intervention.",
    "url": "https://agpt.co",
    "github_url": "https://github.com/Significant-Gravitas/AutoGPT",
    "stars_approx": 170000,
    "tags": ["autonomous", "gpt-4", "memory", "web-search", "open-source"],
    "license": "MIT",
    "added_date": "2026-04-14",
    "last_updated": "2026-04-14",
    "curator_note": "Sparked the autonomous-agent wave in 2023; still the most starred AI agent repo on GitHub.",
    "pricing": "open-source",
    "maturity": "beta"
  },
  {
    "id": "gpt-engineer",
    "name": "GPT Engineer",
    "category": "project",
    "subcategory": "code-generation",
    "description": "Agentic coding tool that generates an entire codebase from a single natural language prompt. Clarifies requirements interactively before writing and can modify existing projects.",
    "url": "https://gptengineer.app",
    "github_url": "https://github.com/gpt-engineer-org/gpt-engineer",
    "stars_approx": 52000,
    "tags": ["code-generation", "scaffolding", "agentic", "open-source", "productivity"],
    "license": "MIT",
    "added_date": "2026-04-14",
    "last_updated": "2026-04-14",
    "curator_note": "The canonical 'spec-to-codebase' project — great for rapid prototyping full applications.",
    "pricing": "open-source",
    "maturity": "beta"
  },
  {
    "id": "swe-agent",
    "name": "SWE-agent",
    "category": "project",
    "subcategory": "software-engineering",
    "description": "Princeton NLP's agent that autonomously resolves real GitHub issues on the SWE-bench benchmark. Uses a custom Agent-Computer Interface (ACI) optimized for code editing tasks.",
    "url": "https://swe-agent.com",
    "github_url": "https://github.com/princeton-nlp/SWE-agent",
    "stars_approx": 14000,
    "tags": ["software-engineering", "github", "benchmark", "agentic", "research"],
    "license": "MIT",
    "added_date": "2026-04-14",
    "last_updated": "2026-04-14",
    "curator_note": "State-of-the-art on SWE-bench; defines the research frontier for autonomous software engineering.",
    "pricing": "open-source",
    "maturity": "experimental"
  },
  {
    "id": "aider",
    "name": "Aider",
    "category": "project",
    "subcategory": "coding-assistant",
    "description": "AI pair programming tool for the terminal. Edits code across multiple files guided by natural language, with git integration that commits changes automatically with descriptive messages.",
    "url": "https://aider.chat",
    "github_url": "https://github.com/Aider-AI/aider",
    "stars_approx": 23000,
    "tags": ["coding-assistant", "terminal", "git", "multi-file", "open-source"],
    "license": "Apache-2.0",
    "added_date": "2026-04-14",
    "last_updated": "2026-04-14",
    "curator_note": "Best terminal-native coding agent — git-aware edits and solid multi-file reasoning make it production-ready.",
    "pricing": "open-source",
    "maturity": "stable"
  }
]
